{
  "id": "e3e817d2-0a81-4ebc-81b8-6a3f12b7a9f1",
  "org_id": "c16922ef-95de-4d43-ac62-a279fac7e14f",
  "root_type": "daily",
  "root_hash": "a4d31481f3caafb2cc89bdf11f422eb1cf658603672d2fb4ab21dcba67d3e6ba",
  "leaf_count": 4250,
  "period_start": "2026-03-01T00:00:00Z",
  "period_end": "2026-03-01T23:59:59Z",
  "created_at": "2026-03-02T01:15:30Z"
}